{
  "schema_version": 1,
  "generated_at": "2026-02-16T00:00:00Z",
  "repository_root": ".",
  "schema_path": "tasks/schemas/m21-scaffold-inventory.schema.json",
  "source_candidates_path": "tasks/reports/m21-scaffold-merge-remove-decision-matrix.json",
  "summary": {
    "total_candidates": 13,
    "existing_crate_count": 12,
    "missing_owner_count": 0,
    "total_runtime_reference_hits": 4,
    "total_test_touchpoint_hits": 0
  },
  "candidates": [
    {
      "candidate_id": "tau-algorithm",
      "surface": "crate:tau-algorithm",
      "owner": "training-runtime",
      "action": "keep",
      "crate_name": "tau-algorithm",
      "crate_path": "crates/tau-algorithm",
      "crate_exists": true,
      "src_rust_files": 7,
      "src_rust_loc": 3249,
      "runtime_reference_hits": 0,
      "test_touchpoint_hits": 0
    },
    {
      "candidate_id": "tau-browser-automation",
      "surface": "crate:tau-browser-automation",
      "owner": "tools-runtime",
      "action": "remove",
      "crate_name": "tau-browser-automation",
      "crate_path": "crates/tau-browser-automation",
      "crate_exists": true,
      "src_rust_files": 3,
      "src_rust_loc": 1465,
      "runtime_reference_hits": 0,
      "test_touchpoint_hits": 0
    },
    {
      "candidate_id": "tau-contract-runner-remnants",
      "surface": "contract-runner remnant paths across retained crates",
      "owner": "runtime-core",
      "action": "remove",
      "crate_name": null,
      "crate_path": null,
      "crate_exists": false,
      "src_rust_files": 0,
      "src_rust_loc": 0,
      "runtime_reference_hits": 0,
      "test_touchpoint_hits": 0
    },
    {
      "candidate_id": "tau-custom-command",
      "surface": "crate:tau-custom-command",
      "owner": "events-runtime",
      "action": "keep",
      "crate_name": "tau-custom-command",
      "crate_path": "crates/tau-custom-command",
      "crate_exists": true,
      "src_rust_files": 4,
      "src_rust_loc": 3178,
      "runtime_reference_hits": 0,
      "test_touchpoint_hits": 0
    },
    {
      "candidate_id": "tau-dashboard-widget-contracts",
      "surface": "crate:tau-dashboard (contract widgets)",
      "owner": "gateway-ui",
      "action": "merge",
      "crate_name": "tau-dashboard",
      "crate_path": "crates/tau-dashboard",
      "crate_exists": true,
      "src_rust_files": 3,
      "src_rust_loc": 1910,
      "runtime_reference_hits": 0,
      "test_touchpoint_hits": 0
    },
    {
      "candidate_id": "tau-memory-postgres-backend",
      "surface": "crate:tau-memory (postgres fixture backend)",
      "owner": "memory-runtime",
      "action": "remove",
      "crate_name": "tau-memory",
      "crate_path": "crates/tau-memory",
      "crate_exists": true,
      "src_rust_files": 3,
      "src_rust_loc": 3406,
      "runtime_reference_hits": 4,
      "test_touchpoint_hits": 0
    },
    {
      "candidate_id": "tau-trainer",
      "surface": "crate:tau-trainer",
      "owner": "training-runtime",
      "action": "keep",
      "crate_name": "tau-trainer",
      "crate_path": "crates/tau-trainer",
      "crate_exists": true,
      "src_rust_files": 6,
      "src_rust_loc": 5691,
      "runtime_reference_hits": 0,
      "test_touchpoint_hits": 0
    },
    {
      "candidate_id": "tau-training-proxy",
      "surface": "crate:tau-training-proxy",
      "owner": "training-runtime",
      "action": "keep",
      "crate_name": "tau-training-proxy",
      "crate_path": "crates/tau-training-proxy",
      "crate_exists": true,
      "src_rust_files": 1,
      "src_rust_loc": 534,
      "runtime_reference_hits": 0,
      "test_touchpoint_hits": 0
    },
    {
      "candidate_id": "tau-training-runner",
      "surface": "crate:tau-training-runner",
      "owner": "training-runtime",
      "action": "keep",
      "crate_name": "tau-training-runner",
      "crate_path": "crates/tau-training-runner",
      "crate_exists": true,
      "src_rust_files": 1,
      "src_rust_loc": 2323,
      "runtime_reference_hits": 0,
      "test_touchpoint_hits": 0
    },
    {
      "candidate_id": "tau-training-store",
      "surface": "crate:tau-training-store",
      "owner": "training-runtime",
      "action": "keep",
      "crate_name": "tau-training-store",
      "crate_path": "crates/tau-training-store",
      "crate_exists": true,
      "src_rust_files": 2,
      "src_rust_loc": 2276,
      "runtime_reference_hits": 0,
      "test_touchpoint_hits": 0
    },
    {
      "candidate_id": "tau-training-tracer",
      "surface": "crate:tau-training-tracer",
      "owner": "training-runtime",
      "action": "keep",
      "crate_name": "tau-training-tracer",
      "crate_path": "crates/tau-training-tracer",
      "crate_exists": true,
      "src_rust_files": 1,
      "src_rust_loc": 493,
      "runtime_reference_hits": 0,
      "test_touchpoint_hits": 0
    },
    {
      "candidate_id": "tau-training-types",
      "surface": "crate:tau-training-types",
      "owner": "training-runtime",
      "action": "keep",
      "crate_name": "tau-training-types",
      "crate_path": "crates/tau-training-types",
      "crate_exists": true,
      "src_rust_files": 1,
      "src_rust_loc": 1227,
      "runtime_reference_hits": 0,
      "test_touchpoint_hits": 0
    },
    {
      "candidate_id": "tau-voice-runtime",
      "surface": "crate:tau-voice",
      "owner": "multi-channel-runtime",
      "action": "remove",
      "crate_name": "tau-voice",
      "crate_path": "crates/tau-voice",
      "crate_exists": true,
      "src_rust_files": 4,
      "src_rust_loc": 3111,
      "runtime_reference_hits": 0,
      "test_touchpoint_hits": 0
    }
  ]
}
